{
  "schema_version": "1.0.0",
  "review_decision_id": "66666666-6666-4666-8666-666666666666",
  "survey_id": "11111111-1111-4111-8111-111111111111",
  "subject_type": "geometry",
  "subject_id": "space_library",
  "action": "accept",
  "actor_id": "reviewer_demo",
  "decided_at": "2026-09-21T10:10:00+05:30",
  "reason": "Room outline matches the captured evidence.",
  "evidence_refs": ["roomplan_structure"],
  "previous_value": null,
  "new_value": {"accepted": true}
}

